{
  "version": "0.2",
  "metadata": {
    "c3xCommand": "breakdown",
    "vcsBranch": "test",
    "vcsCommitSha": "1234",
    "vcsCommitAuthorName": "hugo",
    "vcsCommitAuthorEmail": "hugo@test.com",
    "vcsCommitTimestamp": "2021-10-11T22:41:00.144866-04:00",
    "vcsCommitMessage": "mymessage",
    "vcsRepositoryUrl": "https://github.com/c3xdev/c3x.git"
  },
  "currency": "USD",
  "projects": [],
  "totalHourlyCost": "0",
  "totalMonthlyCost": "0",
  "pastTotalHourlyCost": "0",
  "pastTotalMonthlyCost": "0",
  "diffTotalHourlyCost": "0",
  "diffTotalMonthlyCost": "0",
  "timeGenerated": "2023-02-13T13:59:41.908876Z",
  "summary": {
    "totalDetectedResources": 0,
    "totalSupportedResources": 0,
    "totalUnsupportedResources": 0,
    "totalUsageBasedResources": 0,
    "totalNoPriceResources": 0,
    "unsupportedResourceCounts": {},
    "noPriceResourceCounts": {}
  }
}
